{
  "member_id": "M0303",
  "as_of": "2026-09-28",
  "windows_days": [
    7,
    30
  ],
  "profile": {
    "age_band": "45-54",
    "job_type": "desk"
  },
  "metrics": {
    "steps": {
      "7d": 2774,
      "30d": 2852,
      "chg_pct": -2.7
    },
    "active_minutes": {
      "7d": 9.6,
      "30d": 10.9,
      "chg_pct": -12.1
    },
    "sleep_hours": {
      "7d": 6.7,
      "30d": 6.7,
      "chg_pct": 0.5
    },
    "resting_hr": {
      "7d": 76.1,
      "30d": 75.5,
      "chg_pct": 0.9
    }
  },
  "engagement": {
    "app_opens_per_day": {
      "7d": 0.0,
      "30d": 0.4,
      "chg_pct": -100.0
    },
    "days_since_last_open": 20,
    "last_active_date": "2026-09-08",
    "app_streak_days": 0,
    "content_views_7d": 0,
    "challenges_joined_30d": 0
  },
  "activity": {
    "active_streak_days": 0,
    "consistency_score": 66
  },
  "mood": {
    "avg_30d": 2.0,
    "trend": "insufficient_data",
    "recent_checkins": [],
    "low_count_recent": 0
  },
  "data_quality": {
    "sync_rate_30d": 0.93
  },
  "ml": {
    "persona": "Quiet Drifters",
    "disengagement_risk": 0.87,
    "risk_band": "high"
  }
}